{
  "fixture_schema": "pixir.presenter.fixture",
  "fixture_version": 1,
  "scenario": "child-write-and-policy-deny",
  "source_class": "real_minimized",
  "observed_at": "2026-07-30T11:12:09Z",
  "inputs": {
    "terminal_envelope": {
      "kind": "delegate_result",
      "delegate_id": "dlg-child-write-deny",
      "parent_session_id": "parent-child-write-deny",
      "strategy": "subagents",
      "mode": "bounded_write",
      "status": "partial",
      "children": [
        {
          "subagent_id": "sub-writer",
          "child_session_id": "child-writer",
          "agent": "worker",
          "status": "failed",
          "workspace_mode": "shared",
          "next_actions": [
            "inspect_child_session_log",
            "request_policy_expansion"
          ]
        }
      ]
    },
    "delegate_snapshot": null,
    "parent_log": [
      {
        "seq": 0,
        "ts": "2026-07-30T11:12:00Z",
        "type": "subagent_event",
        "data": {
          "event": "started",
          "status": "running",
          "subagent_id": "sub-writer",
          "child_session_id": "child-writer",
          "agent": "worker",
          "workspace_mode": "shared"
        }
      },
      {
        "seq": 1,
        "ts": "2026-07-30T11:12:09Z",
        "type": "subagent_event",
        "data": {
          "event": "failed",
          "status": "failed",
          "subagent_id": "sub-writer",
          "child_session_id": "child-writer",
          "agent": "worker",
          "workspace_mode": "shared",
          "summary": "Wrote inside the lane; one write outside the allowlist was denied."
        }
      }
    ],
    "parent_log_origin": "fixture",
    "child_logs": {
      "child-writer": [
        {
          "seq": 1,
          "ts": "2026-07-30T11:12:02Z",
          "type": "tool_call",
          "data": {
            "call_id": "call-write-allowed",
            "name": "write",
            "args": {
              "path": "lib/pixir/monitor_note.ex"
            }
          }
        },
        {
          "seq": 2,
          "ts": "2026-07-30T11:12:03Z",
          "type": "tool_result",
          "data": {
            "call_id": "call-write-allowed",
            "ok": true
          }
        },
        {
          "seq": 3,
          "ts": "2026-07-30T11:12:05Z",
          "type": "permission_decision",
          "data": {
            "call_id": "call-write-denied",
            "decision": "deny",
            "gate": "write_policy",
            "policy_id": "policy-writer-lane",
            "policy_hash": "sha256:0f2c1a9d",
            "policy_version": 1,
            "tool": "write",
            "requested_path": "docs/adr/0039-out-of-lane.md",
            "normalized_path": "docs/adr/0039-out-of-lane.md",
            "matched_rule": "no_allow_match",
            "rule": "no_allow_match"
          }
        },
        {
          "seq": 4,
          "ts": "2026-07-30T11:12:06Z",
          "type": "tool_result",
          "data": {
            "call_id": "call-write-denied",
            "ok": false
          }
        }
      ]
    },
    "runtime_diagnostics": null,
    "owner_state": {
      "state": "snapshot_only",
      "reachable": false
    },
    "evidence_mirror": null
  },
  "completeness": {
    "parent_log": "complete",
    "child_logs": "complete",
    "terminal_envelope": "complete_for_contract_scenario"
  },
  "sanitization": {
    "absolute_paths_removed": true,
    "identifiers_replaced": true,
    "model_content_minimized": true,
    "secrets_removed": true
  }
}
